{
  "version": 1,
  "vendors": [
    {
      "id": "openai",
      "name": "OpenAI",
      "apiStyle": "openai",
      "source": "ported"
    },
    {
      "id": "ernie",
      "name": "Baidu ERNIE (Wenxin)",
      "apiStyle": "native",
      "source": "ported"
    },
    {
      "id": "qwen",
      "name": "Alibaba Qwen (DashScope)",
      "apiStyle": "native",
      "source": "ported"
    },
    {
      "id": "anthropic",
      "name": "Anthropic Claude",
      "apiStyle": "anthropic",
      "source": "extended"
    },
    {
      "id": "google",
      "name": "Google Gemini",
      "apiStyle": "gemini",
      "source": "extended"
    },
    {
      "id": "deepseek",
      "name": "DeepSeek",
      "apiStyle": "openai",
      "source": "extended"
    },
    {
      "id": "mistral",
      "name": "Mistral AI",
      "apiStyle": "openai",
      "source": "extended"
    },
    {
      "id": "cohere",
      "name": "Cohere",
      "apiStyle": "native",
      "source": "extended"
    },
    {
      "id": "xai",
      "name": "xAI Grok",
      "apiStyle": "openai",
      "source": "extended"
    },
    {
      "id": "groq",
      "name": "Groq",
      "apiStyle": "openai",
      "source": "extended"
    },
    {
      "id": "azure",
      "name": "Azure OpenAI",
      "apiStyle": "openai",
      "source": "extended"
    }
  ],
  "params": [
    "model",
    "messages",
    "system",
    "temperature",
    "top_p",
    "max_tokens",
    "stream",
    "stop",
    "n",
    "presence_penalty",
    "frequency_penalty",
    "top_k",
    "seed"
  ],
  "table": {
    "model": {
      "openai": {
        "name": "model",
        "supported": true,
        "source": "ported"
      },
      "ernie": {
        "name": "model",
        "supported": true,
        "source": "ported"
      },
      "qwen": {
        "name": "model",
        "supported": true,
        "source": "ported"
      },
      "anthropic": {
        "name": "model",
        "supported": true,
        "source": "extended"
      },
      "google": {
        "name": "model",
        "supported": true,
        "source": "extended"
      },
      "deepseek": {
        "name": "model",
        "supported": true,
        "source": "extended"
      },
      "mistral": {
        "name": "model",
        "supported": true,
        "source": "extended"
      },
      "cohere": {
        "name": "model",
        "supported": true,
        "source": "extended"
      },
      "xai": {
        "name": "model",
        "supported": true,
        "source": "extended"
      },
      "groq": {
        "name": "model",
        "supported": true,
        "source": "extended"
      },
      "azure": {
        "name": "model",
        "supported": true,
        "source": "extended",
        "notes": "deployment name; the full model id lives in the request URL"
      }
    },
    "messages": {
      "openai": {
        "name": "messages",
        "supported": true,
        "source": "ported"
      },
      "ernie": {
        "name": "messages",
        "supported": true,
        "source": "ported"
      },
      "qwen": {
        "name": "messages",
        "supported": true,
        "source": "ported"
      },
      "anthropic": {
        "name": "messages",
        "supported": true,
        "source": "extended"
      },
      "google": {
        "name": "contents",
        "supported": true,
        "source": "extended",
        "notes": "role system maps to systemInstruction instead"
      },
      "deepseek": {
        "name": "messages",
        "supported": true,
        "source": "extended"
      },
      "mistral": {
        "name": "messages",
        "supported": true,
        "source": "extended"
      },
      "cohere": {
        "name": "messages",
        "supported": true,
        "source": "extended"
      },
      "xai": {
        "name": "messages",
        "supported": true,
        "source": "extended"
      },
      "groq": {
        "name": "messages",
        "supported": true,
        "source": "extended"
      },
      "azure": {
        "name": "messages",
        "supported": true,
        "source": "extended"
      }
    },
    "system": {
      "openai": {
        "name": "system",
        "supported": true,
        "source": "extended",
        "notes": "sent as a message with role \"system\""
      },
      "ernie": {
        "name": "system",
        "supported": true,
        "source": "extended",
        "notes": "sent as a message with role \"system\""
      },
      "qwen": {
        "name": "system",
        "supported": true,
        "source": "extended",
        "notes": "sent as a message with role \"system\""
      },
      "anthropic": {
        "name": "system",
        "supported": true,
        "source": "extended",
        "notes": "top-level field (string or blocks), not a message"
      },
      "google": {
        "name": "systemInstruction",
        "supported": true,
        "source": "extended",
        "notes": "top-level field; `system_instruction` is also accepted"
      },
      "deepseek": {
        "name": "system",
        "supported": true,
        "source": "extended",
        "notes": "sent as a message with role \"system\""
      },
      "mistral": {
        "name": "system",
        "supported": true,
        "source": "extended",
        "notes": "sent as a message with role \"system\""
      },
      "cohere": {
        "name": "system",
        "supported": true,
        "source": "extended",
        "notes": "sent as a message with role \"system\" (chat v2)"
      },
      "xai": {
        "name": "system",
        "supported": true,
        "source": "extended",
        "notes": "sent as a message with role \"system\""
      },
      "groq": {
        "name": "system",
        "supported": true,
        "source": "extended",
        "notes": "sent as a message with role \"system\""
      },
      "azure": {
        "name": "system",
        "supported": true,
        "source": "extended",
        "notes": "sent as a message with role \"system\""
      }
    },
    "temperature": {
      "openai": {
        "name": "temperature",
        "supported": true,
        "source": "ported"
      },
      "ernie": {
        "name": "temperature",
        "supported": true,
        "source": "ported",
        "transform": {
          "kind": "clamp",
          "min": 0.01,
          "max": 1
        }
      },
      "qwen": {
        "name": "temperature",
        "supported": true,
        "source": "ported"
      },
      "anthropic": {
        "name": "temperature",
        "supported": true,
        "source": "extended",
        "notes": "range 0..1"
      },
      "google": {
        "name": "generationConfig.temperature",
        "supported": true,
        "source": "extended",
        "notes": "range 0..2"
      },
      "deepseek": {
        "name": "temperature",
        "supported": true,
        "source": "extended",
        "notes": "range 0..2"
      },
      "mistral": {
        "name": "temperature",
        "supported": true,
        "source": "extended"
      },
      "cohere": {
        "name": "temperature",
        "supported": true,
        "source": "extended",
        "notes": "range 0..5"
      },
      "xai": {
        "name": "temperature",
        "supported": true,
        "source": "extended",
        "notes": "range 0..2"
      },
      "groq": {
        "name": "temperature",
        "supported": true,
        "source": "extended"
      },
      "azure": {
        "name": "temperature",
        "supported": true,
        "source": "extended"
      }
    },
    "top_p": {
      "openai": {
        "name": "top_p",
        "supported": true,
        "source": "ported"
      },
      "ernie": {
        "name": "top_p",
        "supported": true,
        "source": "ported",
        "transform": {
          "kind": "clamp",
          "min": 0,
          "max": 1
        }
      },
      "qwen": {
        "name": "top_p",
        "supported": true,
        "source": "ported"
      },
      "anthropic": {
        "name": "top_p",
        "supported": true,
        "source": "extended",
        "notes": "use with top_k instead of temperature"
      },
      "google": {
        "name": "generationConfig.topP",
        "supported": true,
        "source": "extended",
        "notes": "range 0..1"
      },
      "deepseek": {
        "name": "top_p",
        "supported": true,
        "source": "extended",
        "notes": "recommended to use together with temperature"
      },
      "mistral": {
        "name": "top_p",
        "supported": true,
        "source": "extended"
      },
      "cohere": {
        "name": "p",
        "supported": true,
        "source": "extended"
      },
      "xai": {
        "name": "top_p",
        "supported": true,
        "source": "extended"
      },
      "groq": {
        "name": "top_p",
        "supported": true,
        "source": "extended"
      },
      "azure": {
        "name": "top_p",
        "supported": true,
        "source": "extended"
      }
    },
    "max_tokens": {
      "openai": {
        "name": "max_tokens",
        "supported": true,
        "source": "ported",
        "notes": "newer reasoning models prefer max_completion_tokens"
      },
      "ernie": {
        "name": "max_output_tokens",
        "supported": true,
        "source": "ported"
      },
      "qwen": {
        "name": "max_tokens",
        "supported": true,
        "source": "ported"
      },
      "anthropic": {
        "name": "max_tokens",
        "supported": true,
        "source": "extended",
        "notes": "REQUIRED for most Anthropic models"
      },
      "google": {
        "name": "generationConfig.maxOutputTokens",
        "supported": true,
        "source": "extended"
      },
      "deepseek": {
        "name": "max_tokens",
        "supported": true,
        "source": "extended"
      },
      "mistral": {
        "name": "max_tokens",